{"$defs":{"hash":{"pattern":"^[a-f0-9]{64}$","type":"string"}},"$id":"https://katherineseye.com/schemas/synthetic-executive/memory-retrieval-receipt.schema.json","$schema":"https://json-schema.org/draft/2020-12/schema","additionalProperties":false,"properties":{"boundedTaskConstructionPermitted":{"const":true},"candidateMemoryIds":{"items":{"type":"string"},"type":"array"},"candidateScores":{"items":{"type":"object"},"type":"array"},"createdAt":{"format":"date-time","type":"string"},"currentEpisodeId":{"minLength":1,"type":"string"},"fabricatedSimilarityProhibited":{"const":true},"novelFailureClassificationPermitted":{"const":true},"queryHash":{"$ref":"#/$defs/hash"},"receiptHash":{"$ref":"#/$defs/hash"},"receiptType":{"const":"EXECUTIVE_MEMORY_RETRIEVAL"},"recurrencePermitted":{"type":"boolean"},"rejectedCandidates":{"items":{"type":"object"},"type":"array"},"resultClassification":{"enum":["VALID_EMPTY","MATCHES_FOUND"],"type":"string"},"retrievalEngine":{"minLength":1,"type":"string"},"retrievalEngineVersion":{"minLength":1,"type":"string"},"retrievalReasonSummary":{"minLength":1,"type":"string"},"schemaVersion":{"const":"1.0"},"selectedMemoryIds":{"items":{"type":"string"},"type":"array"},"structuredQueryFacets":{"type":"object"}},"required":["schemaVersion","receiptType","currentEpisodeId","queryHash","structuredQueryFacets","candidateMemoryIds","candidateScores","selectedMemoryIds","rejectedCandidates","resultClassification","recurrencePermitted","novelFailureClassificationPermitted","boundedTaskConstructionPermitted","fabricatedSimilarityProhibited","retrievalReasonSummary","retrievalEngine","retrievalEngineVersion","createdAt","receiptHash"],"title":"Memory Retrieval Receipt","type":"object"}
