{"boundedTaskConstructionPermitted":true,"candidateMemoryIds":["KE-V3-C14-memory-01"],"candidateScores":[{"candidateScore":0.082759,"memoryId":"KE-V3-C14-memory-01","status":"VALIDATED_BY_TRANSFER"}],"createdAt":"2026-08-13T17:26:39.085Z","currentEpisodeId":"KE-V3-C14","fabricatedSimilarityProhibited":true,"novelFailureClassificationPermitted":true,"queryHash":"94d64c7ee8b2ea41c5fb264f584a2c435de45f752094ebbeabc282299ce6e1cf","receiptHash":"6943a0303879b1b85aa79550eef384ad6eb0065bd33b02ce2df2ae1a0f201ec1","receiptType":"EXECUTIVE_MEMORY_RETRIEVAL","recurrencePermitted":true,"rejectedCandidates":[],"resultClassification":"MATCHES_FOUND","retrievalEngine":"STRUCTURED_TOKEN_OVERLAP_V1","retrievalEngineVersion":"1.0","retrievalReasonSummary":"Selected by structured facets and token-overlap similarity; status preserved.","schemaVersion":"1.0","selectedMemoryIds":["KE-V3-C14-memory-01"],"structuredQueryFacets":{"cohort":["COLLECTIBLE_RECURRENCE_CONTRADICTION"],"failureClass":["MUSEUM_STORAGE_RACK_COMPLETION_BEFORE_VERIFIED_D"],"pattern":["MUSEUM_STORAGE_RACK_COMPLETION_BEFORE_VERIFIED_D"]}}
