{"boundedTaskConstructionPermitted":true,"candidateMemoryIds":[],"candidateScores":[],"createdAt":"2026-08-13T17:13:42.421Z","currentEpisodeId":"KE-V3-C03","fabricatedSimilarityProhibited":true,"novelFailureClassificationPermitted":true,"queryHash":"cb4d1fd77657c8f2a8c94b436ca1a06a615cb3f4eaed5cea31d4c837b31c8385","receiptHash":"941c39a28476b36dcc93c3e0a225b7aad5ddee192e395a1f23b62edb79c524ff","receiptType":"EXECUTIVE_MEMORY_RETRIEVAL","recurrencePermitted":false,"rejectedCandidates":[],"resultClassification":"VALID_EMPTY","retrievalEngine":"STRUCTURED_TOKEN_OVERLAP_V1","retrievalEngineVersion":"1.0","retrievalReasonSummary":"Valid empty result: no candidate met the positive relevance threshold; recurrence is unavailable while evidence-based novel classification remains legal.","schemaVersion":"1.0","selectedMemoryIds":[],"structuredQueryFacets":{"cohort":["EVERYDAY_NOVEL_RECOVERY"],"failureClass":["SMART_THERMOSTAT_SCHEDULE_INDEX_OFFSET"],"pattern":["SMART_THERMOSTAT_SCHEDULE_INDEX_OFFSET"]}}
