{"boundedTaskConstructionPermitted":true,"candidateMemoryIds":[],"candidateScores":[],"createdAt":"2026-08-13T17:23:44.801Z","currentEpisodeId":"KE-V3-C11","fabricatedSimilarityProhibited":true,"novelFailureClassificationPermitted":true,"queryHash":"6184b27d95e8de658d05d76559403666cad06a31fddf34877ab18e162d09615a","receiptHash":"9d3f5e0d1e11ba9d386a18e9fb61f1bc73c4767f196a0e4ef466e705a9f0f27c","receiptType":"EXECUTIVE_MEMORY_RETRIEVAL","recurrencePermitted":false,"rejectedCandidates":[],"resultClassification":"VALID_EMPTY","retrievalEngine":"STRUCTURED_TOKEN_OVERLAP_V1","retrievalEngineVersion":"1.0","retrievalReasonSummary":"Valid empty result: no candidate met the positive relevance threshold; recurrence is unavailable while evidence-based novel classification remains legal.","schemaVersion":"1.0","selectedMemoryIds":[],"structuredQueryFacets":{"cohort":["COLLECTIBLE_RECONSTRUCTION"],"failureClass":["VINYL_PRESSING_PLAYBACK_EQUALIZATION_PROFILE_"],"pattern":["VINYL_PRESSING_PLAYBACK_EQUALIZATION_PROFILE_"]}}
